{"$schema":"https://kokunoyumeto.github.io/program-matematika-indonesia/schema/course-capsule-v1/course-capsule-v1.schema.json","course":{"level":"D","outcome":"Memasuki literatur aljabar pascasarjana dengan penguasaan konstruksi universal dan bukti struktural.","prerequisites":["C40","B40"],"purpose":"Modul, hasil kali tensor, barisan eksak, teori medan/Galois lanjut, aljabar komutatif, teori representasi, dan struktur untuk geometri/topologi.","state":"published","title":"Aljabar Pascasarjana","topic":"Aljabar"},"course_id":"D70","course_native":{"corpus":"Wen-Wei Li Jilid 1 lengkap + TeX teori representasi Alexander Duncan berlisensi CC BY 4.0 + enam rentang CRing/GFDL berbatas + lapisan penghubung dan solusi asli","edition":"https://zenodo.org/records/22160944/files/01_metode-aljabar-jilid-1-id-lengkap.pdf?download=1","note":"Paket O013 lengkap dan publik memuat empat komponen: Li Jilid I lengkap 521 halaman, tujuh akar TeX Duncan lengkap 114 halaman, enam pilihan CRing tepat 74 halaman, serta lapisan rute dan penguasaan asli 7 halaman. Totalnya 716 halaman pembaca; seluruh sembilan berkas Zenodo telah diverifikasi anonim.","repository":"https://github.com/KokunoYumeto/metode-aljabar-jilid-1-id","status":"available_unverified","version":"1.0.0","zenodo":"https://doi.org/10.5281/zenodo.22160944"},"evidence":[],"layers":{"curriculum":{"course_identity":"D70","outcomes":["Memasuki literatur aljabar pascasarjana dengan penguasaan konstruksi universal dan bukti struktural."],"prerequisites":["C40","B40"],"route_id":"route:D70","status":"verified","unit_identity_status":"unknown"},"educator":{"evidence":[{"kind":"course_native_educator_material","locator":"https://zenodo.org/records/22160944","note":"Capability evidence is indexed without copying the course-native content.","verified_date":"2026-08-31"}],"features":["lesson_sequences","prerequisite_diagnostics","remix_selectors"],"resources":[],"shared_identity_scope":"learner_and_educator_views_share_course_unit_concept_exercise_ids","status":"available_unverified","unit_alignment_status":"unknown","unlisted_features_status":"unknown"},"federation":{"components":[{"access":"public","id":"D70:primary","kind":"course-native-primary","provenance":[{"kind":"course_native_component_reference","locator":"https://zenodo.org/records/22160944/files/01_metode-aljabar-jilid-1-id-lengkap.pdf?download=1","note":"Reference provenance; independent rights verification is not implied."}],"rights_status":"unknown","status":"available_unverified","title":"Wen-Wei Li Jilid 1 lengkap + TeX teori representasi Alexander Duncan berlisensi CC BY 4.0 + enam rentang CRing/GFDL berbatas + lapisan penghubung dan solusi asli","url":"https://zenodo.org/records/22160944/files/01_metode-aljabar-jilid-1-id-lengkap.pdf?download=1"}],"status":"verified","zero_copy":true},"interoperability":{"capsule_contract":"open-course-capsule/1.0.0","design_policy":{"adapter_absence_blocks_release":false,"canonical_capsule_format":"application/x-ndjson","capsule_additive":true,"content_copied_into_capsule":false,"course_native_authoritative":true,"native_identity_preserved":true,"optional_adapters":["myst","quarto","xliff"],"policy":{"bytes":2816,"locator":"https://kokunoyumeto.github.io/program-matematika-indonesia/data/course-capsule-v1/backend-design-policy-v1.json","sha256":"2369d55d6faa699139b830e68ab317f9961f23e329e004408622726eb1c776d2"},"profile":"thin_format_neutral_zero_copy","public_baseline":{"bytes":3032,"locator":"https://kokunoyumeto.github.io/program-matematika-indonesia/data/course-capsule-v1/public-baseline-v0.62.12.json","sha256":"1892239d022c0c8f44bd9e87e77c7f4214a101a6a494e83994cfecee95f94253"}},"mapping_scope":"course_level_without_content_copy","native_identity_preserved":true,"semantic_adapter":{"evidence":[],"mapping_scope":"capsule_only","status":"not_yet_produced"},"status":"verified"},"learner":{"capabilities":{"chapter_downloads":"not_yet_produced","mathml":"not_yet_produced","print_profile":"not_yet_produced","semantic_html":"not_yet_produced"},"epub":{"status":"not_yet_produced"},"online_html":{"status":"not_yet_produced"},"pdf":{"format":"application/pdf","status":"available_unverified","url":"https://zenodo.org/records/22160944/files/01_metode-aljabar-jilid-1-id-lengkap.pdf?download=1"},"portable_html":{"status":"not_yet_produced"},"primary":{"format":"application/pdf","status":"available_unverified","url":"https://zenodo.org/records/22160944/files/01_metode-aljabar-jilid-1-id-lengkap.pdf?download=1"},"status":"available_unverified","tools":[]},"production":{"build_status":"unknown","deterministic_replay_status":"unknown","edition":"https://zenodo.org/records/22160944/files/01_metode-aljabar-jilid-1-id-lengkap.pdf?download=1","release_status":"available_unverified","repository":"https://github.com/KokunoYumeto/metode-aljabar-jilid-1-id","status":"available_unverified","zenodo":"https://doi.org/10.5281/zenodo.22160944"},"translation":{"corrections_status":"unknown","ledger_status":"unknown","rights_status":"unknown","source_locale":"und","status":"available_unverified","target_locale":"id-ID","terminology_status":"unknown"}},"learner_directed":true,"locale":"id-ID","open_access_policy":{"download_restriction_forbidden":true,"educator_materials_public":true,"private_access_forbidden":true,"public_access_required":true,"rights_are_not_access_gates":true},"schema_id":"interlanguage/open-course-capsule/v1","schema_version":"1.0.0"}